{"schema_version":4,"release_id":"testnet-v3","status":"PROPOSED_NOT_ACTIVATED","governance_approval_id":null,"chain_id":1266,"network_id":"testnet","protocol_version":"posy/3.0","activation_boundary":"fresh_genesis_block_zero","activation_epoch":null,"activation_height":null,"epoch_length_blocks":1000,"active_validator_count":5,"consensus_cluster_count":1,"healthy_path":["PROPOSAL","VOTE","QC"],"ordinary_vote_phases":1,"normal_qc_types":1,"exceptional_certificate":"TC","chained_qc_commit_depth":3,"leader_schedule_domain":"PoSy/LeaderSchedule/v3","leader_schedule_rank_bits":512,"leader_schedule_weighted":false,"leader_lease_blocks":10,"takeover_rule":"sequential_strict_dual_quorum_tc_for_current_lease","count_quorum_rule":"3*signed_count>2*active_validator_count","required_distinct_signers":4,"weight_quorum_rule":"3*signed_weight>2*total_frozen_weight","consensus_signature_algorithm":"mldsa65","allow_quorum_reduction":false,"allow_local_leader_election":false,"require_single_validator_failure_liveness":true,"signer_journal_required":true,"safety_halt_on_conflicting_valid_qcs":true,"etdag_finality_separation_required":true,"protected_execution_binding_required":true,"initial_etdag_activation":"governed_genesis_binding_required","target_block_time_ms":500,"proposal_timeout_ms":1500,"vote_timeout_ms":1500,"max_round_timeout_ms":10000,"performance_targets":{"proposal_latency_ms":450,"qc_formation_latency_ms":1850,"chained_finality_latency_ms":6000,"tc_recovery_latency_ms":3000,"finality_p95_ms":7500,"finality_p99_ms":9000}}